<?xml version="1.0"?>
<?xml-stylesheet type="text/xsl" href="pdml2html.xsl"?>
<!-- You can find pdml2html.xsl in C:\Program Files\Wireshark or at https://code.wireshark.org/review/gitweb?p=wireshark.git;a=blob_plain;f=pdml2html.xsl. -->
<pdml version="0" creator="wireshark/2.0.2" time="Tue May 17 12:50:47 2016" capture_file="F:\zplusStuffMaybe.pcapng">
<packet>
  <proto name="geninfo" pos="0" showname="General information" size="60">
    <field name="num" pos="0" show="1" showname="Number" value="1" size="60"/>
    <field name="len" pos="0" show="60" showname="Frame Length" value="3c" size="60"/>
    <field name="caplen" pos="0" show="60" showname="Captured Length" value="3c" size="60"/>
    <field name="timestamp" pos="0" show="May 17, 2016 12:23:43.292706000 New Zealand Standard Time" showname="Captured Time" value="1463444623.292706000" size="60"/>
  </proto>
  <proto name="frame" showname="Frame 1: 60 bytes on wire (480 bits), 60 bytes captured (480 bits) on interface 0" size="60" pos="0">
    <field name="frame.interface_id" showname="Interface id: 0 (\Device\NPF_{209E16E9-6B7B-48CB-AAB7-A5CD7F07EACC})" size="0" pos="0" show="0"/>
    <field name="frame.encap_type" showname="Encapsulation type: Ethernet (1)" size="0" pos="0" show="1"/>
    <field name="frame.time" showname="Arrival Time: May 17, 2016 12:23:43.292706000 New Zealand Standard Time" size="0" pos="0" show="May 17, 2016 12:23:43.292706000 New Zealand Standard Time"/>
    <field name="frame.offset_shift" showname="Time shift for this packet: 0.000000000 seconds" size="0" pos="0" show="0.000000000"/>
    <field name="frame.time_epoch" showname="Epoch Time: 1463444623.292706000 seconds" size="0" pos="0" show="1463444623.292706000"/>
    <field name="frame.time_delta" showname="Time delta from previous captured frame: 0.000000000 seconds" size="0" pos="0" show="0.000000000"/>
    <field name="frame.time_delta_displayed" showname="Time delta from previous displayed frame: 0.000000000 seconds" size="0" pos="0" show="0.000000000"/>
    <field name="frame.time_relative" showname="Time since reference or first frame: 0.000000000 seconds" size="0" pos="0" show="0.000000000"/>
    <field name="frame.number" showname="Frame Number: 1" size="0" pos="0" show="1"/>
    <field name="frame.len" showname="Frame Length: 60 bytes (480 bits)" size="0" pos="0" show="60"/>
    <field name="frame.cap_len" showname="Capture Length: 60 bytes (480 bits)" size="0" pos="0" show="60"/>
    <field name="frame.marked" showname="Frame is marked: False" size="0" pos="0" show="0"/>
    <field name="frame.ignored" showname="Frame is ignored: False" size="0" pos="0" show="0"/>
    <field name="frame.protocols" showname="Protocols in frame: eth:ethertype:ip:tcp" size="0" pos="0" show="eth:ethertype:ip:tcp"/>
    <field name="frame.coloring_rule.name" showname="Coloring Rule Name: TCP" size="0" pos="0" show="TCP"/>
    <field name="frame.coloring_rule.string" showname="Coloring Rule String: tcp" size="0" pos="0" show="tcp"/>
  </proto>
  <proto name="eth" showname="Ethernet II, Src: Chaintec_51:98:7e (00:50:70:51:98:7e), Dst: IntelCor_a2:14:89 (00:02:b3:a2:14:89)" size="14" pos="0">
    <field name="eth.dst" showname="Destination: IntelCor_a2:14:89 (00:02:b3:a2:14:89)" size="6" pos="0" show="00:02:b3:a2:14:89" value="0002b3a21489">
      <field name="eth.dst_resolved" showname="Destination (resolved): IntelCor_a2:14:89" hide="yes" size="6" pos="0" show="IntelCor_a2:14:89" value="0002b3a21489"/>
      <field name="eth.addr" showname="Address: IntelCor_a2:14:89 (00:02:b3:a2:14:89)" size="6" pos="0" show="00:02:b3:a2:14:89" value="0002b3a21489"/>
      <field name="eth.addr_resolved" showname="Address (resolved): IntelCor_a2:14:89" hide="yes" size="6" pos="0" show="IntelCor_a2:14:89" value="0002b3a21489"/>
      <field name="eth.lg" showname=".... ..0. .... .... .... .... = LG bit: Globally unique address (factory default)" size="3" pos="0" show="0" value="0" unmaskedvalue="0002b3"/>
      <field name="eth.ig" showname=".... ...0 .... .... .... .... = IG bit: Individual address (unicast)" size="3" pos="0" show="0" value="0" unmaskedvalue="0002b3"/>
    </field>
    <field name="eth.src" showname="Source: Chaintec_51:98:7e (00:50:70:51:98:7e)" size="6" pos="6" show="00:50:70:51:98:7e" value="00507051987e">
      <field name="eth.src_resolved" showname="Source (resolved): Chaintec_51:98:7e" hide="yes" size="6" pos="6" show="Chaintec_51:98:7e" value="00507051987e"/>
      <field name="eth.addr" showname="Address: Chaintec_51:98:7e (00:50:70:51:98:7e)" size="6" pos="6" show="00:50:70:51:98:7e" value="00507051987e"/>
      <field name="eth.addr_resolved" showname="Address (resolved): Chaintec_51:98:7e" hide="yes" size="6" pos="6" show="Chaintec_51:98:7e" value="00507051987e"/>
      <field name="eth.lg" showname=".... ..0. .... .... .... .... = LG bit: Globally unique address (factory default)" size="3" pos="6" show="0" value="0" unmaskedvalue="005070"/>
      <field name="eth.ig" showname=".... ...0 .... .... .... .... = IG bit: Individual address (unicast)" size="3" pos="6" show="0" value="0" unmaskedvalue="005070"/>
    </field>
    <field name="eth.type" showname="Type: IPv4 (0x0800)" size="2" pos="12" show="0x00000800" value="0800"/>
    <field name="eth.padding" showname="Padding: 020812000000" size="6" pos="54" show="02:08:12:00:00:00" value="020812000000"/>
  </proto>
  <proto name="ip" showname="Internet Protocol Version 4, Src: 192.168.10.12, Dst: 192.168.10.10" size="20" pos="14">
    <field name="ip.version" showname="0100 .... = Version: 4" size="1" pos="14" show="4" value="4" unmaskedvalue="45"/>
    <field name="ip.hdr_len" showname=".... 0101 = Header Length: 20 bytes" size="1" pos="14" show="5" value="5" unmaskedvalue="45"/>
    <field name="ip.dsfield" showname="Differentiated Services Field: 0x00 (DSCP: CS0, ECN: Not-ECT)" size="1" pos="15" show="0x00000000" value="00">
      <field name="ip.dsfield.dscp" showname="0000 00.. = Differentiated Services Codepoint: Default (0)" size="1" pos="15" show="0" value="0" unmaskedvalue="00"/>
      <field name="ip.dsfield.ecn" showname=".... ..00 = Explicit Congestion Notification: Not ECN-Capable Transport (0)" size="1" pos="15" show="0" value="0" unmaskedvalue="00"/>
    </field>
    <field name="ip.len" showname="Total Length: 40" size="2" pos="16" show="40" value="0028"/>
    <field name="ip.id" showname="Identification: 0x4296 (17046)" size="2" pos="18" show="0x00004296" value="4296"/>
    <field name="ip.flags" showname="Flags: 0x02 (Don&#x27;t Fragment)" size="1" pos="20" show="0x00000002" value="40">
      <field name="ip.flags.rb" showname="0... .... = Reserved bit: Not set" size="1" pos="20" show="0" value="40"/>
      <field name="ip.flags.df" showname=".1.. .... = Don&#x27;t fragment: Set" size="1" pos="20" show="1" value="40"/>
      <field name="ip.flags.mf" showname="..0. .... = More fragments: Not set" size="1" pos="20" show="0" value="40"/>
    </field>
    <field name="ip.frag_offset" showname="Fragment offset: 0" size="2" pos="20" show="0" value="4000"/>
    <field name="ip.ttl" showname="Time to live: 64" size="1" pos="22" show="64" value="40"/>
    <field name="ip.proto" showname="Protocol: TCP (6)" size="1" pos="23" show="6" value="06"/>
    <field name="ip.checksum" showname="Header checksum: 0x62d3 [validation disabled]" size="2" pos="24" show="0x000062d3" value="62d3">
      <field name="ip.checksum_good" showname="Good: False" size="2" pos="24" show="0" value="62d3"/>
      <field name="ip.checksum_bad" showname="Bad: False" size="2" pos="24" show="0" value="62d3"/>
    </field>
    <field name="ip.src" showname="Source: 192.168.10.12" size="4" pos="26" show="192.168.10.12" value="c0a80a0c"/>
    <field name="ip.addr" showname="Source or Destination Address: 192.168.10.12" hide="yes" size="4" pos="26" show="192.168.10.12" value="c0a80a0c"/>
    <field name="ip.src_host" showname="Source Host: 192.168.10.12" hide="yes" size="4" pos="26" show="192.168.10.12" value="c0a80a0c"/>
    <field name="ip.host" showname="Source or Destination Host: 192.168.10.12" hide="yes" size="4" pos="26" show="192.168.10.12" value="c0a80a0c"/>
    <field name="ip.dst" showname="Destination: 192.168.10.10" size="4" pos="30" show="192.168.10.10" value="c0a80a0a"/>
    <field name="ip.addr" showname="Source or Destination Address: 192.168.10.10" hide="yes" size="4" pos="30" show="192.168.10.10" value="c0a80a0a"/>
    <field name="ip.dst_host" showname="Destination Host: 192.168.10.10" hide="yes" size="4" pos="30" show="192.168.10.10" value="c0a80a0a"/>
    <field name="ip.host" showname="Source or Destination Host: 192.168.10.10" hide="yes" size="4" pos="30" show="192.168.10.10" value="c0a80a0a"/>
    <field name="" show="Source GeoIP: Unknown" size="4" pos="26" value="c0a80a0c"/>
    <field name="" show="Destination GeoIP: Unknown" size="4" pos="30" value="c0a80a0a"/>
  </proto>
  <proto name="tcp" showname="Transmission Control Protocol, Src Port: 1122 (1122), Dst Port: 1065 (1065), Seq: 1, Ack: 1, Len: 0" size="20" pos="34">
    <field name="tcp.srcport" showname="Source Port: 1122" size="2" pos="34" show="1122" value="0462"/>
    <field name="tcp.dstport" showname="Destination Port: 1065" size="2" pos="36" show="1065" value="0429"/>
    <field name="tcp.port" showname="Source or Destination Port: 1122" hide="yes" size="2" pos="34" show="1122" value="0462"/>
    <field name="tcp.port" showname="Source or Destination Port: 1065" hide="yes" size="2" pos="36" show="1065" value="0429"/>
    <field name="tcp.stream" showname="Stream index: 0" size="0" pos="34" show="0"/>
    <field name="tcp.len" showname="TCP Segment Len: 0" size="1" pos="46" show="0" value="50"/>
    <field name="tcp.seq" showname="Sequence number: 1    (relative sequence number)" size="4" pos="38" show="1" value="351c6c60"/>
    <field name="tcp.ack" showname="Acknowledgment number: 1    (relative ack number)" size="4" pos="42" show="1" value="0c032588"/>
    <field name="tcp.hdr_len" showname="Header Length: 20 bytes" size="1" pos="46" show="20" value="50"/>
    <field name="tcp.flags" showname="Flags: 0x010 (ACK)" size="2" pos="46" show="0x00000010" value="10" unmaskedvalue="5010">
      <field name="tcp.flags.res" showname="000. .... .... = Reserved: Not set" size="1" pos="46" show="0" value="0" unmaskedvalue="50"/>
      <field name="tcp.flags.ns" showname="...0 .... .... = Nonce: Not set" size="1" pos="46" show="0" value="0" unmaskedvalue="50"/>
      <field name="tcp.flags.cwr" showname=".... 0... .... = Congestion Window Reduced (CWR): Not set" size="1" pos="47" show="0" value="0" unmaskedvalue="10"/>
      <field name="tcp.flags.ecn" showname=".... .0.. .... = ECN-Echo: Not set" size="1" pos="47" show="0" value="0" unmaskedvalue="10"/>
      <field name="tcp.flags.urg" showname=".... ..0. .... = Urgent: Not set" size="1" pos="47" show="0" value="0" unmaskedvalue="10"/>
      <field name="tcp.flags.ack" showname=".... ...1 .... = Acknowledgment: Set" size="1" pos="47" show="1" value="FFFFFFFF" unmaskedvalue="10"/>
      <field name="tcp.flags.push" showname=".... .... 0... = Push: Not set" size="1" pos="47" show="0" value="0" unmaskedvalue="10"/>
      <field name="tcp.flags.reset" showname=".... .... .0.. = Reset: Not set" size="1" pos="47" show="0" value="0" unmaskedvalue="10"/>
      <field name="tcp.flags.syn" showname=".... .... ..0. = Syn: Not set" size="1" pos="47" show="0" value="0" unmaskedvalue="10"/>
      <field name="tcp.flags.fin" showname=".... .... ...0 = Fin: Not set" size="1" pos="47" show="0" value="0" unmaskedvalue="10"/>
      <field name="tcp.flags.str" showname="TCP Flags: *******A****" size="2" pos="46" show="*******A****" value="5010"/>
    </field>
    <field name="tcp.window_size_value" showname="Window size value: 33232" size="2" pos="48" show="33232" value="81d0"/>
    <field name="tcp.window_size" showname="Calculated window size: 33232" size="2" pos="48" show="33232" value="81d0"/>
    <field name="tcp.window_size_scalefactor" showname="Window size scaling factor: -1 (unknown)" size="2" pos="48" show="-1" value="81d0"/>
    <field name="tcp.checksum" showname="Checksum: 0xbd0a [validation disabled]" size="2" pos="50" show="0x0000bd0a" value="bd0a">
      <field name="tcp.checksum_good" showname="Good Checksum: False" size="2" pos="50" show="0" value="bd0a"/>
      <field name="tcp.checksum_bad" showname="Bad Checksum: False" size="2" pos="50" show="0" value="bd0a"/>
    </field>
    <field name="tcp.urgent_pointer" showname="Urgent pointer: 0" size="2" pos="52" show="0" value="0000"/>
  </proto>
</packet>

<packet>
  <proto name="geninfo" pos="0" showname="General information" size="54">
    <field name="num" pos="0" show="2" showname="Number" value="2" size="54"/>
    <field name="len" pos="0" show="54" showname="Frame Length" value="36" size="54"/>
    <field name="caplen" pos="0" show="54" showname="Captured Length" value="36" size="54"/>
    <field name="timestamp" pos="0" show="May 17, 2016 12:23:43.292807000 New Zealand Standard Time" showname="Captured Time" value="1463444623.292807000" size="54"/>
  </proto>
  <proto name="frame" showname="Frame 2: 54 bytes on wire (432 bits), 54 bytes captured (432 bits) on interface 0" size="54" pos="0">
    <field name="frame.interface_id" showname="Interface id: 0 (\Device\NPF_{209E16E9-6B7B-48CB-AAB7-A5CD7F07EACC})" size="0" pos="0" show="0"/>
    <field name="frame.encap_type" showname="Encapsulation type: Ethernet (1)" size="0" pos="0" show="1"/>
    <field name="frame.time" showname="Arrival Time: May 17, 2016 12:23:43.292807000 New Zealand Standard Time" size="0" pos="0" show="May 17, 2016 12:23:43.292807000 New Zealand Standard Time"/>
    <field name="frame.offset_shift" showname="Time shift for this packet: 0.000000000 seconds" size="0" pos="0" show="0.000000000"/>
    <field name="frame.time_epoch" showname="Epoch Time: 1463444623.292807000 seconds" size="0" pos="0" show="1463444623.292807000"/>
    <field name="frame.time_delta" showname="Time delta from previous captured frame: 0.000101000 seconds" size="0" pos="0" show="0.000101000"/>
    <field name="frame.time_delta_displayed" showname="Time delta from previous displayed frame: 0.000101000 seconds" size="0" pos="0" show="0.000101000"/>
    <field name="frame.time_relative" showname="Time since reference or first frame: 0.000101000 seconds" size="0" pos="0" show="0.000101000"/>
    <field name="frame.number" showname="Frame Number: 2" size="0" pos="0" show="2"/>
    <field name="frame.len" showname="Frame Length: 54 bytes (432 bits)" size="0" pos="0" show="54"/>
    <field name="frame.cap_len" showname="Capture Length: 54 bytes (432 bits)" size="0" pos="0" show="54"/>
    <field name="frame.marked" showname="Frame is marked: False" size="0" pos="0" show="0"/>
    <field name="frame.ignored" showname="Frame is ignored: False" size="0" pos="0" show="0"/>
    <field name="frame.protocols" showname="Protocols in frame: eth:ethertype:ip:tcp" size="0" pos="0" show="eth:ethertype:ip:tcp"/>
    <field name="frame.coloring_rule.name" showname="Coloring Rule Name: Bad TCP" size="0" pos="0" show="Bad TCP"/>
    <field name="frame.coloring_rule.string" showname="Coloring Rule String: tcp.analysis.flags &amp;&amp; !tcp.analysis.window_update" size="0" pos="0" show="tcp.analysis.flags &amp;&amp; !tcp.analysis.window_update"/>
  </proto>
  <proto name="eth" showname="Ethernet II, Src: IntelCor_a2:14:89 (00:02:b3:a2:14:89), Dst: Chaintec_51:98:7e (00:50:70:51:98:7e)" size="14" pos="0">
    <field name="eth.dst" showname="Destination: Chaintec_51:98:7e (00:50:70:51:98:7e)" size="6" pos="0" show="00:50:70:51:98:7e" value="00507051987e">
      <field name="eth.dst_resolved" showname="Destination (resolved): Chaintec_51:98:7e" hide="yes" size="6" pos="0" show="Chaintec_51:98:7e" value="00507051987e"/>
      <field name="eth.addr" showname="Address: Chaintec_51:98:7e (00:50:70:51:98:7e)" size="6" pos="0" show="00:50:70:51:98:7e" value="00507051987e"/>
      <field name="eth.addr_resolved" showname="Address (resolved): Chaintec_51:98:7e" hide="yes" size="6" pos="0" show="Chaintec_51:98:7e" value="00507051987e"/>
      <field name="eth.lg" showname=".... ..0. .... .... .... .... = LG bit: Globally unique address (factory default)" size="3" pos="0" show="0" value="0" unmaskedvalue="005070"/>
      <field name="eth.ig" showname=".... ...0 .... .... .... .... = IG bit: Individual address (unicast)" size="3" pos="0" show="0" value="0" unmaskedvalue="005070"/>
    </field>
    <field name="eth.src" showname="Source: IntelCor_a2:14:89 (00:02:b3:a2:14:89)" size="6" pos="6" show="00:02:b3:a2:14:89" value="0002b3a21489">
      <field name="eth.src_resolved" showname="Source (resolved): IntelCor_a2:14:89" hide="yes" size="6" pos="6" show="IntelCor_a2:14:89" value="0002b3a21489"/>
      <field name="eth.addr" showname="Address: IntelCor_a2:14:89 (00:02:b3:a2:14:89)" size="6" pos="6" show="00:02:b3:a2:14:89" value="0002b3a21489"/>
      <field name="eth.addr_resolved" showname="Address (resolved): IntelCor_a2:14:89" hide="yes" size="6" pos="6" show="IntelCor_a2:14:89" value="0002b3a21489"/>
      <field name="eth.lg" showname=".... ..0. .... .... .... .... = LG bit: Globally unique address (factory default)" size="3" pos="6" show="0" value="0" unmaskedvalue="0002b3"/>
      <field name="eth.ig" showname=".... ...0 .... .... .... .... = IG bit: Individual address (unicast)" size="3" pos="6" show="0" value="0" unmaskedvalue="0002b3"/>
    </field>
    <field name="eth.type" showname="Type: IPv4 (0x0800)" size="2" pos="12" show="0x00000800" value="0800"/>
  </proto>
  <proto name="ip" showname="Internet Protocol Version 4, Src: 192.168.10.10, Dst: 192.168.10.12" size="20" pos="14">
    <field name="ip.version" showname="0100 .... = Version: 4" size="1" pos="14" show="4" value="4" unmaskedvalue="45"/>
    <field name="ip.hdr_len" showname=".... 0101 = Header Length: 20 bytes" size="1" pos="14" show="5" value="5" unmaskedvalue="45"/>
    <field name="ip.dsfield" showname="Differentiated Services Field: 0x00 (DSCP: CS0, ECN: Not-ECT)" size="1" pos="15" show="0x00000000" value="00">
      <field name="ip.dsfield.dscp" showname="0000 00.. = Differentiated Services Codepoint: Default (0)" size="1" pos="15" show="0" value="0" unmaskedvalue="00"/>
      <field name="ip.dsfield.ecn" showname=".... ..00 = Explicit Congestion Notification: Not ECN-Capable Transport (0)" size="1" pos="15" show="0" value="0" unmaskedvalue="00"/>
    </field>
    <field name="ip.len" showname="Total Length: 40" size="2" pos="16" show="40" value="0028"/>
    <field name="ip.id" showname="Identification: 0x1e60 (7776)" size="2" pos="18" show="0x00001e60" value="1e60"/>
    <field name="ip.flags" showname="Flags: 0x02 (Don&#x27;t Fragment)" size="1" pos="20" show="0x00000002" value="40">
      <field name="ip.flags.rb" showname="0... .... = Reserved bit: Not set" size="1" pos="20" show="0" value="40"/>
      <field name="ip.flags.df" showname=".1.. .... = Don&#x27;t fragment: Set" size="1" pos="20" show="1" value="40"/>
      <field name="ip.flags.mf" showname="..0. .... = More fragments: Not set" size="1" pos="20" show="0" value="40"/>
    </field>
    <field name="ip.frag_offset" showname="Fragment offset: 0" size="2" pos="20" show="0" value="4000"/>
    <field name="ip.ttl" showname="Time to live: 128" size="1" pos="22" show="128" value="80"/>
    <field name="ip.proto" showname="Protocol: TCP (6)" size="1" pos="23" show="6" value="06"/>
    <field name="ip.checksum" showname="Header checksum: 0x4709 [validation disabled]" size="2" pos="24" show="0x00004709" value="4709">
      <field name="ip.checksum_good" showname="Good: False" size="2" pos="24" show="0" value="4709"/>
      <field name="ip.checksum_bad" showname="Bad: False" size="2" pos="24" show="0" value="4709"/>
    </field>
    <field name="ip.src" showname="Source: 192.168.10.10" size="4" pos="26" show="192.168.10.10" value="c0a80a0a"/>
    <field name="ip.addr" showname="Source or Destination Address: 192.168.10.10" hide="yes" size="4" pos="26" show="192.168.10.10" value="c0a80a0a"/>
    <field name="ip.src_host" showname="Source Host: 192.168.10.10" hide="yes" size="4" pos="26" show="192.168.10.10" value="c0a80a0a"/>
    <field name="ip.host" showname="Source or Destination Host: 192.168.10.10" hide="yes" size="4" pos="26" show="192.168.10.10" value="c0a80a0a"/>
    <field name="ip.dst" showname="Destination: 192.168.10.12" size="4" pos="30" show="192.168.10.12" value="c0a80a0c"/>
    <field name="ip.addr" showname="Source or Destination Address: 192.168.10.12" hide="yes" size="4" pos="30" show="192.168.10.12" value="c0a80a0c"/>
    <field name="ip.dst_host" showname="Destination Host: 192.168.10.12" hide="yes" size="4" pos="30" show="192.168.10.12" value="c0a80a0c"/>
    <field name="ip.host" showname="Source or Destination Host: 192.168.10.12" hide="yes" size="4" pos="30" show="192.168.10.12" value="c0a80a0c"/>
    <field name="" show="Source GeoIP: Unknown" size="4" pos="26" value="c0a80a0a"/>
    <field name="" show="Destination GeoIP: Unknown" size="4" pos="30" value="c0a80a0c"/>
  </proto>
  <proto name="tcp" showname="Transmission Control Protocol, Src Port: 1065 (1065), Dst Port: 1122 (1122), Seq: 1, Ack: 2, Len: 0" size="20" pos="34">
    <field name="tcp.srcport" showname="Source Port: 1065" size="2" pos="34" show="1065" value="0429"/>
    <field name="tcp.dstport" showname="Destination Port: 1122" size="2" pos="36" show="1122" value="0462"/>
    <field name="tcp.port" showname="Source or Destination Port: 1065" hide="yes" size="2" pos="34" show="1065" value="0429"/>
    <field name="tcp.port" showname="Source or Destination Port: 1122" hide="yes" size="2" pos="36" show="1122" value="0462"/>
    <field name="tcp.stream" showname="Stream index: 0" size="0" pos="34" show="0"/>
    <field name="tcp.len" showname="TCP Segment Len: 0" size="1" pos="46" show="0" value="50"/>
    <field name="tcp.seq" showname="Sequence number: 1    (relative sequence number)" size="4" pos="38" show="1" value="0c032588"/>
    <field name="tcp.ack" showname="Acknowledgment number: 2    (relative ack number)" size="4" pos="42" show="2" value="351c6c61"/>
    <field name="tcp.hdr_len" showname="Header Length: 20 bytes" size="1" pos="46" show="20" value="50"/>
    <field name="tcp.flags" showname="Flags: 0x010 (ACK)" size="2" pos="46" show="0x00000010" value="10" unmaskedvalue="5010">
      <field name="tcp.flags.res" showname="000. .... .... = Reserved: Not set" size="1" pos="46" show="0" value="0" unmaskedvalue="50"/>
      <field name="tcp.flags.ns" showname="...0 .... .... = Nonce: Not set" size="1" pos="46" show="0" value="0" unmaskedvalue="50"/>
      <field name="tcp.flags.cwr" showname=".... 0... .... = Congestion Window Reduced (CWR): Not set" size="1" pos="47" show="0" value="0" unmaskedvalue="10"/>
      <field name="tcp.flags.ecn" showname=".... .0.. .... = ECN-Echo: Not set" size="1" pos="47" show="0" value="0" unmaskedvalue="10"/>
      <field name="tcp.flags.urg" showname=".... ..0. .... = Urgent: Not set" size="1" pos="47" show="0" value="0" unmaskedvalue="10"/>
      <field name="tcp.flags.ack" showname=".... ...1 .... = Acknowledgment: Set" size="1" pos="47" show="1" value="FFFFFFFF" unmaskedvalue="10"/>
      <field name="tcp.flags.push" showname=".... .... 0... = Push: Not set" size="1" pos="47" show="0" value="0" unmaskedvalue="10"/>
      <field name="tcp.flags.reset" showname=".... .... .0.. = Reset: Not set" size="1" pos="47" show="0" value="0" unmaskedvalue="10"/>
      <field name="tcp.flags.syn" showname=".... .... ..0. = Syn: Not set" size="1" pos="47" show="0" value="0" unmaskedvalue="10"/>
      <field name="tcp.flags.fin" showname=".... .... ...0 = Fin: Not set" size="1" pos="47" show="0" value="0" unmaskedvalue="10"/>
      <field name="tcp.flags.str" showname="TCP Flags: *******A****" size="2" pos="46" show="*******A****" value="5010"/>
    </field>
    <field name="tcp.window_size_value" showname="Window size value: 64651" size="2" pos="48" show="64651" value="fc8b"/>
    <field name="tcp.window_size" showname="Calculated window size: 64651" size="2" pos="48" show="64651" value="fc8b"/>
    <field name="tcp.window_size_scalefactor" showname="Window size scaling factor: -1 (unknown)" size="2" pos="48" show="-1" value="fc8b"/>
    <field name="tcp.checksum" showname="Checksum: 0x9581 [validation disabled]" size="2" pos="50" show="0x00009581" value="9581">
      <field name="tcp.checksum_good" showname="Good Checksum: False" size="2" pos="50" show="0" value="9581"/>
      <field name="tcp.checksum_bad" showname="Bad Checksum: False" size="2" pos="50" show="0" value="9581"/>
    </field>
    <field name="tcp.urgent_pointer" showname="Urgent pointer: 0" size="2" pos="52" show="0" value="0000"/>
    <field name="tcp.analysis" showname="SEQ/ACK analysis" size="0" pos="34" show="" value="">
      <field name="tcp.analysis.flags" showname="TCP Analysis Flags" size="0" pos="34" show="" value="">
        <field name="_ws.expert" showname="Expert Info (Warn/Sequence): ACKed segment that wasn&#x27;t captured (common at capture start)" size="0" pos="34">
          <field name="tcp.analysis.ack_lost_segment" showname="ACKed segment that wasn&#x27;t captured (common at capture start)" size="0" pos="0" show="" value=""/>
          <field name="_ws.expert.message" showname="Message: ACKed segment that wasn&#x27;t captured (common at capture start)" hide="yes" size="0" pos="0" show="ACKed segment that wasn&#x27;t captured (common at capture start)"/>
          <field name="_ws.expert.severity" showname="Severity level: Warn" size="0" pos="0" show="0x00600000"/>
          <field name="_ws.expert.group" showname="Group: Sequence" size="0" pos="0" show="0x02000000"/>
        </field>
      </field>
    </field>
  </proto>
</packet>

<packet>
  <proto name="geninfo" pos="0" showname="General information" size="64">
    <field name="num" pos="0" show="3" showname="Number" value="3" size="64"/>
    <field name="len" pos="0" show="64" showname="Frame Length" value="40" size="64"/>
    <field name="caplen" pos="0" show="64" showname="Captured Length" value="40" size="64"/>
    <field name="timestamp" pos="0" show="May 17, 2016 12:23:43.609370000 New Zealand Standard Time" showname="Captured Time" value="1463444623.609370000" size="64"/>
  </proto>
  <proto name="frame" showname="Frame 3: 64 bytes on wire (512 bits), 64 bytes captured (512 bits) on interface 0" size="64" pos="0">
    <field name="frame.interface_id" showname="Interface id: 0 (\Device\NPF_{209E16E9-6B7B-48CB-AAB7-A5CD7F07EACC})" size="0" pos="0" show="0"/>
    <field name="frame.encap_type" showname="Encapsulation type: Ethernet (1)" size="0" pos="0" show="1"/>
    <field name="frame.time" showname="Arrival Time: May 17, 2016 12:23:43.609370000 New Zealand Standard Time" size="0" pos="0" show="May 17, 2016 12:23:43.609370000 New Zealand Standard Time"/>
    <field name="frame.offset_shift" showname="Time shift for this packet: 0.000000000 seconds" size="0" pos="0" show="0.000000000"/>
    <field name="frame.time_epoch" showname="Epoch Time: 1463444623.609370000 seconds" size="0" pos="0" show="1463444623.609370000"/>
    <field name="frame.time_delta" showname="Time delta from previous captured frame: 0.316563000 seconds" size="0" pos="0" show="0.316563000"/>
    <field name="frame.time_delta_displayed" showname="Time delta from previous displayed frame: 0.316563000 seconds" size="0" pos="0" show="0.316563000"/>
    <field name="frame.time_relative" showname="Time since reference or first frame: 0.316664000 seconds" size="0" pos="0" show="0.316664000"/>
    <field name="frame.number" showname="Frame Number: 3" size="0" pos="0" show="3"/>
    <field name="frame.len" showname="Frame Length: 64 bytes (512 bits)" size="0" pos="0" show="64"/>
    <field name="frame.cap_len" showname="Capture Length: 64 bytes (512 bits)" size="0" pos="0" show="64"/>
    <field name="frame.marked" showname="Frame is marked: False" size="0" pos="0" show="0"/>
    <field name="frame.ignored" showname="Frame is ignored: False" size="0" pos="0" show="0"/>
    <field name="frame.protocols" showname="Protocols in frame: eth:ethertype:ip:tcp:data" size="0" pos="0" show="eth:ethertype:ip:tcp:data"/>
    <field name="frame.coloring_rule.name" showname="Coloring Rule Name: Bad TCP" size="0" pos="0" show="Bad TCP"/>
    <field name="frame.coloring_rule.string" showname="Coloring Rule String: tcp.analysis.flags &amp;&amp; !tcp.analysis.window_update" size="0" pos="0" show="tcp.analysis.flags &amp;&amp; !tcp.analysis.window_update"/>
  </proto>
  <proto name="eth" showname="Ethernet II, Src: IntelCor_a2:14:89 (00:02:b3:a2:14:89), Dst: Chaintec_51:98:7e (00:50:70:51:98:7e)" size="14" pos="0">
    <field name="eth.dst" showname="Destination: Chaintec_51:98:7e (00:50:70:51:98:7e)" size="6" pos="0" show="00:50:70:51:98:7e" value="00507051987e">
      <field name="eth.dst_resolved" showname="Destination (resolved): Chaintec_51:98:7e" hide="yes" size="6" pos="0" show="Chaintec_51:98:7e" value="00507051987e"/>
      <field name="eth.addr" showname="Address: Chaintec_51:98:7e (00:50:70:51:98:7e)" size="6" pos="0" show="00:50:70:51:98:7e" value="00507051987e"/>
      <field name="eth.addr_resolved" showname="Address (resolved): Chaintec_51:98:7e" hide="yes" size="6" pos="0" show="Chaintec_51:98:7e" value="00507051987e"/>
      <field name="eth.lg" showname=".... ..0. .... .... .... .... = LG bit: Globally unique address (factory default)" size="3" pos="0" show="0" value="0" unmaskedvalue="005070"/>
      <field name="eth.ig" showname=".... ...0 .... .... .... .... = IG bit: Individual address (unicast)" size="3" pos="0" show="0" value="0" unmaskedvalue="005070"/>
    </field>
    <field name="eth.src" showname="Source: IntelCor_a2:14:89 (00:02:b3:a2:14:89)" size="6" pos="6" show="00:02:b3:a2:14:89" value="0002b3a21489">
      <field name="eth.src_resolved" showname="Source (resolved): IntelCor_a2:14:89" hide="yes" size="6" pos="6" show="IntelCor_a2:14:89" value="0002b3a21489"/>
      <field name="eth.addr" showname="Address: IntelCor_a2:14:89 (00:02:b3:a2:14:89)" size="6" pos="6" show="00:02:b3:a2:14:89" value="0002b3a21489"/>
      <field name="eth.addr_resolved" showname="Address (resolved): IntelCor_a2:14:89" hide="yes" size="6" pos="6" show="IntelCor_a2:14:89" value="0002b3a21489"/>
      <field name="eth.lg" showname=".... ..0. .... .... .... .... = LG bit: Globally unique address (factory default)" size="3" pos="6" show="0" value="0" unmaskedvalue="0002b3"/>
      <field name="eth.ig" showname=".... ...0 .... .... .... .... = IG bit: Individual address (unicast)" size="3" pos="6" show="0" value="0" unmaskedvalue="0002b3"/>
    </field>
    <field name="eth.type" showname="Type: IPv4 (0x0800)" size="2" pos="12" show="0x00000800" value="0800"/>
  </proto>
  <proto name="ip" showname="Internet Protocol Version 4, Src: 192.168.10.10, Dst: 192.168.10.12" size="20" pos="14">
    <field name="ip.version" showname="0100 .... = Version: 4" size="1" pos="14" show="4" value="4" unmaskedvalue="45"/>
    <field name="ip.hdr_len" showname=".... 0101 = Header Length: 20 bytes" size="1" pos="14" show="5" value="5" unmaskedvalue="45"/>
    <field name="ip.dsfield" showname="Differentiated Services Field: 0x00 (DSCP: CS0, ECN: Not-ECT)" size="1" pos="15" show="0x00000000" value="00">
      <field name="ip.dsfield.dscp" showname="0000 00.. = Differentiated Services Codepoint: Default (0)" size="1" pos="15" show="0" value="0" unmaskedvalue="00"/>
      <field name="ip.dsfield.ecn" showname=".... ..00 = Explicit Congestion Notification: Not ECN-Capable Transport (0)" size="1" pos="15" show="0" value="0" unmaskedvalue="00"/>
    </field>
    <field name="ip.len" showname="Total Length: 50" size="2" pos="16" show="50" value="0032"/>
    <field name="ip.id" showname="Identification: 0x1e61 (7777)" size="2" pos="18" show="0x00001e61" value="1e61"/>
    <field name="ip.flags" showname="Flags: 0x02 (Don&#x27;t Fragment)" size="1" pos="20" show="0x00000002" value="40">
      <field name="ip.flags.rb" showname="0... .... = Reserved bit: Not set" size="1" pos="20" show="0" value="40"/>
      <field name="ip.flags.df" showname=".1.. .... = Don&#x27;t fragment: Set" size="1" pos="20" show="1" value="40"/>
      <field name="ip.flags.mf" showname="..0. .... = More fragments: Not set" size="1" pos="20" show="0" value="40"/>
    </field>
    <field name="ip.frag_offset" showname="Fragment offset: 0" size="2" pos="20" show="0" value="4000"/>
    <field name="ip.ttl" showname="Time to live: 128" size="1" pos="22" show="128" value="80"/>
    <field name="ip.proto" showname="Protocol: TCP (6)" size="1" pos="23" show="6" value="06"/>
    <field name="ip.checksum" showname="Header checksum: 0x46fe [validation disabled]" size="2" pos="24" show="0x000046fe" value="46fe">
      <field name="ip.checksum_good" showname="Good: False" size="2" pos="24" show="0" value="46fe"/>
      <field name="ip.checksum_bad" showname="Bad: False" size="2" pos="24" show="0" value="46fe"/>
    </field>
    <field name="ip.src" showname="Source: 192.168.10.10" size="4" pos="26" show="192.168.10.10" value="c0a80a0a"/>
    <field name="ip.addr" showname="Source or Destination Address: 192.168.10.10" hide="yes" size="4" pos="26" show="192.168.10.10" value="c0a80a0a"/>
    <field name="ip.src_host" showname="Source Host: 192.168.10.10" hide="yes" size="4" pos="26" show="192.168.10.10" value="c0a80a0a"/>
    <field name="ip.host" showname="Source or Destination Host: 192.168.10.10" hide="yes" size="4" pos="26" show="192.168.10.10" value="c0a80a0a"/>
    <field name="ip.dst" showname="Destination: 192.168.10.12" size="4" pos="30" show="192.168.10.12" value="c0a80a0c"/>
    <field name="ip.addr" showname="Source or Destination Address: 192.168.10.12" hide="yes" size="4" pos="30" show="192.168.10.12" value="c0a80a0c"/>
    <field name="ip.dst_host" showname="Destination Host: 192.168.10.12" hide="yes" size="4" pos="30" show="192.168.10.12" value="c0a80a0c"/>
    <field name="ip.host" showname="Source or Destination Host: 192.168.10.12" hide="yes" size="4" pos="30" show="192.168.10.12" value="c0a80a0c"/>
    <field name="" show="Source GeoIP: Unknown" size="4" pos="26" value="c0a80a0a"/>
    <field name="" show="Destination GeoIP: Unknown" size="4" pos="30" value="c0a80a0c"/>
  </proto>
  <proto name="tcp" showname="Transmission Control Protocol, Src Port: 1065 (1065), Dst Port: 1122 (1122), Seq: 1, Ack: 2, Len: 10" size="20" pos="34">
    <field name="tcp.srcport" showname="Source Port: 1065" size="2" pos="34" show="1065" value="0429"/>
    <field name="tcp.dstport" showname="Destination Port: 1122" size="2" pos="36" show="1122" value="0462"/>
    <field name="tcp.port" showname="Source or Destination Port: 1065" hide="yes" size="2" pos="34" show="1065" value="0429"/>
    <field name="tcp.port" showname="Source or Destination Port: 1122" hide="yes" size="2" pos="36" show="1122" value="0462"/>
    <field name="tcp.stream" showname="Stream index: 0" size="0" pos="34" show="0"/>
    <field name="tcp.len" showname="TCP Segment Len: 10" size="1" pos="46" show="10" value="50"/>
    <field name="tcp.seq" showname="Sequence number: 1    (relative sequence number)" size="4" pos="38" show="1" value="0c032588"/>
    <field name="tcp.nxtseq" showname="Next sequence number: 11    (relative sequence number)" size="0" pos="34" show="11"/>
    <field name="tcp.ack" showname="Acknowledgment number: 2    (relative ack number)" size="4" pos="42" show="2" value="351c6c61"/>
    <field name="tcp.hdr_len" showname="Header Length: 20 bytes" size="1" pos="46" show="20" value="50"/>
    <field name="tcp.flags" showname="Flags: 0x018 (PSH, ACK)" size="2" pos="46" show="0x00000018" value="18" unmaskedvalue="5018">
      <field name="tcp.flags.res" showname="000. .... .... = Reserved: Not set" size="1" pos="46" show="0" value="0" unmaskedvalue="50"/>
      <field name="tcp.flags.ns" showname="...0 .... .... = Nonce: Not set" size="1" pos="46" show="0" value="0" unmaskedvalue="50"/>
      <field name="tcp.flags.cwr" showname=".... 0... .... = Congestion Window Reduced (CWR): Not set" size="1" pos="47" show="0" value="0" unmaskedvalue="18"/>
      <field name="tcp.flags.ecn" showname=".... .0.. .... = ECN-Echo: Not set" size="1" pos="47" show="0" value="0" unmaskedvalue="18"/>
      <field name="tcp.flags.urg" showname=".... ..0. .... = Urgent: Not set" size="1" pos="47" show="0" value="0" unmaskedvalue="18"/>
      <field name="tcp.flags.ack" showname=".... ...1 .... = Acknowledgment: Set" size="1" pos="47" show="1" value="FFFFFFFF" unmaskedvalue="18"/>
      <field name="tcp.flags.push" showname=".... .... 1... = Push: Set" size="1" pos="47" show="1" value="FFFFFFFF" unmaskedvalue="18"/>
      <field name="tcp.flags.reset" showname=".... .... .0.. = Reset: Not set" size="1" pos="47" show="0" value="0" unmaskedvalue="18"/>
      <field name="tcp.flags.syn" showname=".... .... ..0. = Syn: Not set" size="1" pos="47" show="0" value="0" unmaskedvalue="18"/>
      <field name="tcp.flags.fin" showname=".... .... ...0 = Fin: Not set" size="1" pos="47" show="0" value="0" unmaskedvalue="18"/>
      <field name="tcp.flags.str" showname="TCP Flags: *******AP***" size="2" pos="46" show="*******AP***" value="5018"/>
    </field>
    <field name="tcp.window_size_value" showname="Window size value: 64651" size="2" pos="48" show="64651" value="fc8b"/>
    <field name="tcp.window_size" showname="Calculated window size: 64651" size="2" pos="48" show="64651" value="fc8b"/>
    <field name="tcp.window_size_scalefactor" showname="Window size scaling factor: -1 (unknown)" size="2" pos="48" show="-1" value="fc8b"/>
    <field name="tcp.checksum" showname="Checksum: 0x958b [validation disabled]" size="2" pos="50" show="0x0000958b" value="958b">
      <field name="tcp.checksum_good" showname="Good Checksum: False" size="2" pos="50" show="0" value="958b"/>
      <field name="tcp.checksum_bad" showname="Bad Checksum: False" size="2" pos="50" show="0" value="958b"/>
    </field>
    <field name="tcp.urgent_pointer" showname="Urgent pointer: 0" size="2" pos="52" show="0" value="0000"/>
    <field name="tcp.analysis" showname="SEQ/ACK analysis" size="0" pos="34" show="" value="">
      <field name="tcp.analysis.bytes_in_flight" showname="Bytes in flight: 10" size="0" pos="34" show="10"/>
      <field name="tcp.analysis.flags" showname="TCP Analysis Flags" size="0" pos="34" show="" value="">
        <field name="_ws.expert" showname="Expert Info (Warn/Sequence): ACKed segment that wasn&#x27;t captured (common at capture start)" size="0" pos="34">
          <field name="tcp.analysis.ack_lost_segment" showname="ACKed segment that wasn&#x27;t captured (common at capture start)" size="0" pos="0" show="" value=""/>
          <field name="_ws.expert.message" showname="Message: ACKed segment that wasn&#x27;t captured (common at capture start)" hide="yes" size="0" pos="0" show="ACKed segment that wasn&#x27;t captured (common at capture start)"/>
          <field name="_ws.expert.severity" showname="Severity level: Warn" size="0" pos="0" show="0x00600000"/>
          <field name="_ws.expert.group" showname="Group: Sequence" size="0" pos="0" show="0x02000000"/>
        </field>
      </field>
    </field>
  </proto>
  <proto name="fake-field-wrapper">
    <field name="data" value="00680200000000000201">
      <field name="data.data" showname="Data: 00680200000000000201" size="10" pos="54" show="00:68:02:00:00:00:00:00:02:01" value="00680200000000000201"/>
      <field name="data.text" showname="Text: " size="10" pos="54" show="" value="00680200000000000201"/>
      <field name="data.md5_hash" showname="Payload MD5 hash: 82bafdcc900c21956b5b3f3f6ecd17d4" size="0" pos="54" show="82bafdcc900c21956b5b3f3f6ecd17d4"/>
